identifier,pm_id,pmc_id,doi,title,abstract,keywords,authors,journal,article_type,year,project_serial_num,project_num,dbgap_accession,research_initiative,sub_project,likert_score,explanation_DeepSeek-R1-Distill-Qwen-32B,explanation_Llama-3.3-70B-Instruct
36685519_phs002583.v1.p1,36685519,PMC9852913,doi:10.3389/fimmu.2022.1039969,Bispecific killer cell engager with high affinity and specificity toward CD16a on NK cells for cancer immunotherapy.,"The Fc region of monoclonal antibodies (mAbs) interacts with the CD16a receptor on natural killer (NK) cells with ""low affinity"" and ""low selectivity"". This low affinity/selectivity interaction results in not only suboptimal anticancer activity but also induction of adverse effects. CD16a on NK cells binds to the antibody-coated cells, leading to antibody-dependent cell-mediated cytotoxicity (ADCC). Recent clinical data have shown that the increased binding affinity between mAb Fc region and CD16a receptor is responsible for significantly improved therapeutic outcomes. Therefore, the <i>objective</i> of this study was to develop a bispecific killer cell engager (BiKE) with high affinity and specificity/selectivity toward CD16a receptor for NK cell-based cancer immunotherapy. To engineer BiKE, a llama was immunized, then high binding anti-CD16a and anti-HER2 VHH clones were isolated using phage display. ELISA, flow cytometry, and biolayer interferometry (BLI) data showed that the isolated anti-CD16a VHH has high affinity (sub-nanomolar) toward CD16a antigen without cross-reactivity with CD16b-NA1 on neutrophils or CD32b on B cells. Similarly, the data showed that the isolated anti-HER2 VHH has high affinity/specificity toward HER2 antigen. Using a semi-flexible linker, anti-HER2 VHH was recombinantly fused with anti-CD16a VHH to create BiKE:HER2/CD16a. Then, the ability of BiKE:HER2/CD16a to activate NK cells to release cytokines and kill HER2<sup>+</sup> cancer cells was measured. As effector cells, both high-affinity haNK92 (CD16<sup>+</sup>, V176) and low-affinity laNK92 (CD16<sup>+</sup>, F176) cells were used. The data showed that the engineered BiKE:HER2/CD16a activates haNK92 and laNK92 cells to release cytokines much greater than best-in-class mAbs in the clinic. The cytotoxicity data also showed that the developed BiKE induces higher ADCC to both ovarian and breast cancer cells in comparison to Trazimera™ (trastuzumab). According to the BLI data, BiKE:HER2/CD16 recognizes a different epitope on CD16a antigen than IgG-based mAbs; thus, it provides the opportunity for not only monotherapy but also combination therapy with other antibody drugs such as checkpoint inhibitors and antibody-drug conjugates. Taken together, the data demonstrate the creation of a novel BiKE with high affinity and specificity toward CD16a on NK cells with the potential to elicit a superior therapeutic response in patients with HER2<sup>+</sup> cancer than existing anti-HER2 mAbs.","Antibodies, Monoclonal|Antibody-Dependent Cell Cytotoxicity|BiKE|CD16a|Cytokines|HER2|Humans|Immunoglobulin G|Immunotherapy|Killer Cells, Natural|NK92 cells|Neoplasms|Receptor, ErbB-2|Trastuzumab|VHH nanobody|bispecific killer cell engager|cancer immunotherapy|ovarian cancer","Nikkhoi, Shahryar Khoshtinat|Li, Geng|Eleya, Suha|Yang, Ge|Vandavasi, Venu Gopal|Hatefi, Arash",Frontiers in immunology,"Journal Article|Research Support, N.I.H., Extramural|Research Support, Non-U.S. Gov't",2022,HL150852,5U01HL150852-02,phs002583.v1.p1,RADx-rad,Novel Biosensing and VOC,1.0,"The publication abstract focuses on the development of a bispecific killer cell engager (BiKE) for cancer immunotherapy, specifically targeting CD16a on NK cells and HER2 on cancer cells. This research is unrelated to the funding opportunity and grant abstract, which are centered on developing non-invasive biosensing technologies for COVID-19 detection. The publication does not address any aspects of COVID-19, biosensing, or the objectives outlined in the funding opportunity.","The publication abstract is not related to the research objectives of the funding opportunity or the grant abstract. The funding opportunity and grant abstract focus on the development of novel biosensing and detection approaches for COVID-19, while the publication abstract discusses the development of a bispecific killer cell engager for cancer immunotherapy, which is a completely different topic."
36688839_phs002583.v1.p1,36688839,PMC11823678,doi:10.1021/acs.nanolett.2c03958,Nanoparticle-Based Artificial Mitochondrial DNA Transcription Regulator: <i>MitoScript</i>.,"The growing knowledge of the links between aberrant mitochondrial gene transcription and human diseases necessitates both an effective and dynamic approach to control mitochondrial DNA (mtDNA) transcription. To address this challenge, we developed a nanoparticle-based synthetic mitochondrial transcription regulator (<i>MitoScript</i>). <i>MitoScript</i> provides great colloidal stability, excellent biocompatibility, efficient cell uptake, and selective mitochondria targeting and can be monitored in live cells using near-infrared fluorescence. Notably, <i>MitoScript</i> controlled mtDNA transcription in a human cell line in an effective and selective manner. <i>MitoScript</i> targeting the light strand promoter region of mtDNA resulted in the downregulation of ND6 gene silencing, which eventually affected cell redox status, with considerably increased reactive oxygen species (ROS) generation. In summary, we developed <i>MitoScript</i> for the efficient, nonviral modification of mitochondrial DNA transcription. Our platform technology can potentially contribute to understanding the fundamental mechanisms of mitochondrial disorders and developing effective treatments for mitochondrial diseases.","Artificial transcription factors|Biological Transport|DNA, Mitochondrial|Humans|Mitochondria|Mitochondria DNA (mtDNA) manipulations|Mitochondria-targeted delivery|Nanoclusters|Nanomedicine|Nanoparticles|Transcription, Genetic","Yang, Letao|Rathnam, Christopher|Hidaka, Takuya|Hou, Yannan|Conklin, Brandon|Pandian, Ganesh N|Sugiyama, Hiroshi|Lee, Ki-Bum",Nano letters,"Journal Article|Research Support, N.I.H., Extramural|Research Support, Non-U.S. Gov't|Research Support, U.S. Gov't, Non-P.H.S.",2023,HL150852,5U01HL150852-02,phs002583.v1.p1,RADx-rad,Novel Biosensing and VOC,1.5,"The publication abstract focuses on a nanoparticle-based system for regulating mitochondrial DNA transcription, which is unrelated to the funding opportunity and grant abstract that are centered on developing biosensing technologies for COVID-19 detection. The publication does not address any of the specific objectives related to SARS-CoV-2 detection, VOCs, or the development of diagnostic devices.","The publication abstract does not directly address the research objectives of the funding opportunity or the grant abstract. The funding opportunity and grant abstract focus on the development of novel biosensing and detection approaches for COVID-19, while the publication abstract discusses a nanoparticle-based artificial mitochondrial DNA transcription regulator, which is unrelated to COVID-19 diagnostics. Although the publication mentions the development of a platform technology, it is focused on mitochondrial diseases, not COVID-19 or infectious diseases. Therefore, the publication is not relevant to the research objectives outlined in the funding opportunity and grant abstract."
36748919_phs002549.v1.p1,36748919,PMC9908512,doi:10.1177/00099228231152840,Comparison of Symptom Duration Between Children With SARS-CoV-2 and Peers With Other Viral Illnesses During the COVID-19 Pandemic.,"Some children and young people (CYP) with severe acute respiratory syndrome coronavirus 2 (SARS-CoV-2) experience persistent symptoms, commonly called ""long COVID."" It remains unclear whether symptoms of SARS-CoV-2 persist longer than those of other respiratory viruses, particularly in young children. This cross-sectional study involved 372 CYP (0-15 years) tested for SARS-CoV-2. Character and duration of symptoms (cough, runny nose, sore throat, rash, diarrhea, vomiting, sore muscles, fatigue, fever, loss of smell) were compared between CYP with a positive test (n = 100) and those with a negative test (n = 272), while controlling for medical/demographic covariates. The average duration of symptoms for CYP with a positive SARS-CoV-2 test (8.5 ± 10 days) did not differ from that of CYP with a negative test (7.2 ± 5 days, <i>P</i> = .71, d = 0.046). A positive SARS-CoV-2 test did not increase the risk (36/372, 10%) of symptoms persisting for ≥3 weeks (odds ratio = 0.96, 95% confidence interval = 0.45-2.0). These results suggest CYP with non-SARS-CoV-2 infections experience a similar duration of symptoms as peers with SARS-CoV-2 infection.","Adolescent|COVID-19|Child|Child, Preschool|Cross-Sectional Studies|Humans|Pain|Pandemics|Post-Acute COVID-19 Syndrome|SARS-CoV-2|general pediatrics|infectious diseases","Hicks, Steven D",Clinical pediatrics,"Journal Article|Research Support, N.I.H., Extramural|Research Support, Non-U.S. Gov't",2023,HD105610,1R61HD105610-01,phs002549.v1.p1,RADx-rad,PreVAIL kIds,3.0,"The publication abstract discusses the duration of symptoms in children with SARS-CoV-2 compared to other viral illnesses, which is not directly related to the research objectives of the funding opportunity or the grant abstract. The funding opportunity focuses on developing biomarkers and prognostic algorithms for severe SARS-CoV-2 associated illnesses in children, particularly MIS-C, while the publication does not address biomarkers, severity prediction, or the development of diagnostic tools.","The publication abstract is related to the research objectives of the funding opportunity and the grant abstract. The funding opportunity aims to support innovative research to develop novel approaches to characterize the spectrum of SARS-CoV-2 associated illness in children and identify biomarkers for a prognostic algorithm to predict disease severity. The grant abstract proposes a project to develop a diagnostic modality to distinguish varying phenotypes of disease and risk-stratify disease in children with SARS-CoV-2 infection. The publication abstract compares symptom duration between children with SARS-CoV-2 and those with other viral illnesses, which is relevant to understanding the spectrum of disease severity in children with SARS-CoV-2 infection. While the publication abstract does not directly address the development of biomarkers or prognostic algorithms, it provides insights into the duration of symptoms in children with SARS-CoV-2 infection, which could inform the development of such tools."
36751905_phs002569.v1.p1,36751905,PMC10403367,doi:10.1176/appi.ps.20220314,Geographic Trends in Pediatric Psychotropic Medication Dispensing Before and After the Start of the COVID-19 Pandemic.,"This study examined trends and geographic variability in dispensing of prescription psychotropic medications to U.S. youths before and after the start of the COVID-19 pandemic. Using national data on prescription medication dispensing, the authors performed a cross-sectional study examining the monthly percent change in psychotropic medications dispensed (total N=95,639,975) to youths (ages 5-18 years) in 2020 versus 2019, across medication classes and geographic regions. For many medications, more were dispensed in March 2020 than in March 2019 and fewer in April-May 2020 versus April-May 2019. Stimulants had the largest decline: -26.4% in May 2020 versus May 2019. The magnitude of the monthly percent change varied by region. Fewer psychotropic medications were dispensed to U.S. youths after the start of the COVID-19 pandemic compared with 2019. Although some medication classes rebounded to prepandemic dispensing levels by September 2020, dispensing varied by class and region.",Adolescence|Adolescent|COVID-19|Central Nervous System Stimulants|Child|Cross-Sectional Studies|General child psychiatry|Humans|Pandemics|Prescription Drugs|Psychopharmacology|Psychotropic Drugs|Psychotropic drugs|Trends,"Bushnell, Greta|Sun, Jenny W|dosReis, Susan|Camelo Castillo, Wendy|Czaja, Angela S|Durrieu, Geneviève|Gerhard, Tobias|Lee, Haeyoung|Kaguelidou, Florentia|Pudasainee-Kapri, Sangita|Raman, Sudha R|Spence, O'Mareen|Horton, Daniel B","Psychiatric services (Washington, D.C.)","Journal Article|Research Support, N.I.H., Extramural",2023,HD105619,1R61HD105619-01,phs002569.v1.p1,RADx-rad,PreVAIL kIds,1.5,"The publication abstract focuses on trends in psychotropic medication dispensing in children before and after the COVID-19 pandemic. This is unrelated to the funding opportunity and grant abstract, which are centered on developing biomarkers and predictive models for severe COVID-19 outcomes in children. The publication does not address any of the research objectives related to SARS-CoV-2, MIS-C, or prognostic algorithms.","The publication abstract does not directly address the research objectives of the funding opportunity or the grant abstract. The funding opportunity and grant abstract focus on developing novel approaches to diagnose and predict the severity of SARS-CoV-2 associated illness in children, including the multisystem inflammatory syndrome in children (MIS-C). In contrast, the publication abstract examines trends in psychotropic medication dispensing to youths before and after the start of the COVID-19 pandemic, which is not directly related to the diagnosis or prediction of SARS-CoV-2 associated illness in children. Therefore, the publication is not strongly related to the research objectives of the funding opportunity or the grant abstract."
36793427_phs002583.v1.p1,36793427,PMC9923839,doi:10.1021/acsmedchemlett.2c00476,Incorporation of an Isohexide Subunit Improves the Drug-like Properties of Bioactive Compounds.,"An enhanced ability to pre-engineer favorable drug-likeness qualities into bioactive molecules would focus and streamline the drug development process. We find that phenols, carboxylic acids, and a purine react with isosorbide (""GRAS"" designated) under Mitsunobu coupling conditions to deliver the isoidide conjugates selectively and efficiently. Such conjugates show improved solubility and permeability properties compared with the bare scaffold compounds themselves, and the purine adduct may have applications as a 2'-deoxyadenosine isostere. We anticipate additional benefits, implied by their structures, in metabolic stability and reduced toxicity of the isoidide conjugates as well.",,"Sidduri, Achyutharao|Dresel, Mark J|Knapp, Spencer",ACS medicinal chemistry letters,Journal Article,2023,HL150852,5U01HL150852-02,phs002583.v1.p1,RADx-rad,Novel Biosensing and VOC,1.0,"The publication abstract discusses the incorporation of an isohexide subunit to improve drug-like properties of bioactive compounds. This is unrelated to the funding opportunity and grant abstract, which focus on developing a breathalyzer diagnostic platform for COVID-19. The publication does not address biosensing technologies, VOC detection, or any aspects related to COVID-19 diagnostics.","The publication abstract is unrelated to the research objectives of the funding opportunity and the grant abstract. The funding opportunity and grant abstract focus on the development of novel biosensing and detection approaches for COVID-19, while the publication abstract discusses the incorporation of an isohexide subunit to improve the drug-like properties of bioactive compounds, which is not relevant to the topic of COVID-19 diagnostics."
36796454_phs002689.v1.p1,36796454,PMC10257752,doi:10.1016/j.jaci.2023.01.028,Bronchial epithelial cell transcriptional responses to inhaled corticosteroids dictate severe asthmatic outcomes.,"Inhaled corticosteroids (CSs) are the backbone of asthma treatment, improving quality of life, exacerbation rates, and mortality. Although effective for most, a subset of patients with asthma experience CS-resistant disease despite receiving high-dose medication. We sought to investigate the transcriptomic response of bronchial epithelial cells (BECs) to inhaled CSs. Independent component analysis was performed on datasets, detailing the transcriptional response of BECs to CS treatment. The expression of these CS-response components was examined in 2 patient cohorts and investigated in relation to clinical parameters. Supervised learning was used to predict BEC CS responses using peripheral blood gene expression. We identified a signature of CS response that was closely correlated with CS use in patients with asthma. Participants could be separated on the basis of CS-response genes into groups with high and low signature expression. Patients with low expression of CS-response genes, particularly those with a severe asthma diagnosis, showed worse lung function and quality of life. These individuals demonstrated enrichment for T-lymphocyte infiltration in endobronchial brushings. Supervised machine learning identified a 7-gene signature from peripheral blood that reliably identified patients with poor CS-response expression in BECs. Loss of CS transcriptional responses within bronchial epithelium was related to impaired lung function and poor quality of life, particularly in patients with severe asthma. These individuals were identified using minimally invasive blood sampling, suggesting these findings may enable earlier triage to alternative treatments.",Adrenal Cortex Hormones|Asthma|Epithelial Cells|Humans|Quality of Life|corticosteroids|severe asthma|systems biology|transcriptomics,"Ginebaugh, Scott P|Hagner, Matthias|Ray, Anuradha|Erzurum, Serpil C|Comhair, Suzy A A|Denlinger, Loren C|Jarjour, Nizar N|Castro, Mario|Woodruff, Prescott G|Christenson, Stephanie A|Bleecker, Eugene R|Meyers, Deborah A|Hastie, Annette T|Moore, Wendy C|Mauger, David T|Israel, Elliot|Levy, Bruce D|Wenzel, Sally E|Camiolo, Matthew J",The Journal of allergy and clinical immunology,"Journal Article|Research Support, N.I.H., Extramural",2023,HL146002,3U01HL146002-04S2,phs002689.v1.p1,RADx-rad,Novel Biosensing and VOC,1.0,"The publication abstract discusses the transcriptional responses of bronchial epithelial cells to inhaled corticosteroids in asthmatic patients, focusing on gene expression and clinical outcomes. This is unrelated to the funding opportunity and grant abstract, which focus on developing rapid, non-invasive saliva-based tests for SARS-CoV-2 detection. The publication does not address COVID-19, biosensing technologies, or the objectives outlined in the funding opportunity.","The publication abstract is not related to the research objectives of the funding opportunity or the grant abstract. The funding opportunity and grant abstract focus on the development of novel biosensing and detection approaches for COVID-19, while the publication abstract discusses the transcriptional responses of bronchial epithelial cells to inhaled corticosteroids in the context of asthma treatment. There is no overlap or connection between the topics, indicating a strong disagreement between the publication and the funding opportunity/grant objectives."
36804803_phs002522.v1.p1,36804803,PMC11425588,doi:10.1088/1361-6560/acb9d1,A feasibility study on removing lipid deposition in atherosclerotic plaques with ultrasound-assisted laser ablation.,"<i>Objective</i>. Atherosclerosis is the buildup of fats, cholesterol, and other substances on the inner walls of arteries. It can affect arteries of heart, brain, arms, legs, pelvis and kidney, resulting in ischemic heart disease, carotid artery disease, peripheral artery disease and chronic kidney disease. Laser-based treatment techniques like laser atherectomy can be used to treat many common atherosclerostic diseases. However, the use of laser-based treatment remains limited due to the high risk of complications and low efficiency in removing atherosclerostic plaques as compared with other treatment methods. In this study, we developed a technology that used high intensity focused ultrasound to assist laser treatment in the removal of the lipid core of atherosclerotic plaques.<i>Approach</i>. The fundamental mechanism to disrupt atherosclerostic plaque was to enhance the mechanical effect of cavitation during laser/ultrasound therapy. To promote cavitation, spatiotemporally synchronized ultrasound bursts of 2% duty cycle at 0.5 MHz and nanosecond laser pulses at 532 nm wavelength were used. Experiments were first performed on pig belly fat samples to titrate ultrasound and laser parameters. Then, experiments were conducted on human plaque samples, where the lipid depositions of the plaques were targeted.<i>Main results</i>. Our results showed that fat tissue could be removed with an ultrasound peak negative pressure (PNP) of 2.45 MPa and a laser radiant exposure as low as 3.2 mJ mm<sup>-2</sup>. The lipid depositions on the atherosclerostic plaques were removed with laser radiant exposure of 16 mJ mm<sup>-2</sup>in synchronizing with an ultrasound PNP of 5.4 MPa. During all the experiments, laser-only and ultrasound-only control treatments at the same energy levels were not effective in removing the lipid.<i>Significance</i>. The results demonstrated that the addition of ultrasound could effectively reduce the needed laser power for atherosclerotic plaque removal, which will potentially improve treatment safety and efficiency of current laser therapies.","Animals|Feasibility Studies|Humans|Laser Therapy|Lasers|Lipids|Plaque, Atherosclerotic|Swine|atherosclerosis|cavitation|excimer laser coronary angioplasty|ultrasound","Singh, Rohit|Ebersole, Koji C|Yang, Xinmai",Physics in medicine and biology,Journal Article,2023,HL152410,1U01HL152410-01,phs002522.v1.p1,RADx-rad,Novel Biosensing and VOC,1.5,"The publication abstract focuses on a feasibility study using ultrasound-assisted laser ablation to remove lipid deposition in atherosclerotic plaques. This research is centered on improving treatment methods for atherosclerosis, which is unrelated to the funding opportunity and grant abstract that focus on developing novel biosensing technologies for COVID-19 detection. The publication does not address any aspects of COVID-19, VOC detection, or the development of SCENT devices as outlined in the funding opportunity.","The publication abstract is not directly related to the research objectives of the funding opportunity or the grant abstract. The funding opportunity and grant abstract focus on the development of novel biosensing and detection approaches for COVID-19, while the publication abstract discusses a feasibility study on removing lipid deposition in atherosclerotic plaques with ultrasound-assisted laser ablation, which is a different research topic. Although both involve medical research, they are not related to the specific goals of the funding opportunity or grant abstract."
