identifier,pm_id,pmc_id,doi,title,abstract,keywords,authors,journal,article_type,year,project_serial_num,project_num,dbgap_accession,research_initiative,sub_project,likert_score,explanation_DeepSeek-R1-Distill-Qwen-32B,explanation_Llama-3.3-70B-Instruct
35192123_phs002583.v1.p1,35192123,PMC8989651,doi:10.1007/s11010-022-04383-7,Bone morphogenetic protein receptor inhibitors suppress the growth of glioblastoma cells.,"Glioblastomas (GBMs) are aggressive brain tumors that are resistant to chemotherapy and radiation. Bone morphogenetic protein (BMP) ligand BMP4 is being examined as a potential therapeutic for GBMs because it induces differentiation of cancer stem cells (CSCs) to an astrocyte phenotype. ID1 is reported to promote self-renewal and inhibit CSC differentiation. In most cancers, ID1 is transcriptionally upregulated by BMP4 promoting invasion and stemness. This conflicting data bring into question whether BMP signaling is growth suppressive or growth promoting in GBMs. We utilized BMP inhibitors DMH1, JL5, and Ym155 to examine the role of BMP signaling on the growth of GBMs. DMH1 targets BMP type 1 receptors whereas JL5 inhibits both the type 1 and type 2 BMP receptors. Ym155 does not bind the BMP receptors but rather inhibits BMP signaling by inducing the degradation of BMPR2. We show that JL5, DMH1, and Ym155 decreased the expression of ID1 in SD2 and U87 cells. JL5 and Ym155 also decreased the expression of BMPR2 and its downstream target inhibitor of apoptosis protein XIAP. JL5 treatment resulted in significant cell death and suppressed self-renewal to a greater extent than that induced by BMP4 ligand. The lysosome inhibitor chloroquine increases the localization of BMPR2 to the plasma membrane enhancing JL5-induced downregulation of ID1 and cell death in SD2 cells. We show that BMP signaling is growth promoting in GBMs. These studies suggest the need for development of BMP inhibitors and evaluation as potential therapeutic for GBMs.",BMP|BMP inhibitors|BMPR2|Bone Morphogenetic Protein 4|Bone Morphogenetic Protein Receptors|Bone Morphogenetic Proteins|Cancer stem cells|Glioblastoma|Humans|ID1|Ligands|Signal Transduction,"Kaye, Joel|Mondal, Arindam|Foty, Ramsey|Jia, Dongxuan|Langenfeld, John",Molecular and cellular biochemistry,Journal Article,2022,HL150852,5U01HL150852-02,phs002583.v1.p1,RADx-rad,Novel Biosensing and VOC,1.0,"The publication abstract discusses the suppression of glioblastoma cell growth using bone morphogenetic protein receptor inhibitors, which is unrelated to the funding opportunity and grant abstract focused on developing a breathalyzer diagnostic platform for COVID-19. The publication does not address any aspects of biosensing, VOC detection, or COVID-19 diagnostics.","The publication abstract is not related to the research objectives of the funding opportunity or the grant abstract. The funding opportunity and grant abstract focus on the development of novel biosensing and detection approaches for COVID-19, while the publication abstract discusses the role of bone morphogenetic protein receptor inhibitors in suppressing the growth of glioblastoma cells, which is a completely different topic."
35225261_phs002583.v1.p1,35225261,PMC10858653,doi:10.3791/62336,Natural Killer (NK) and CAR-NK Cell Expansion Method using Membrane Bound-IL-21-Modified B Cell Line.,"Chimeric antigen receptor (CAR)-modified immune cell therapy has become an emerging treatment for cancers and infectious diseases. NK-based immunotherapy, particularly CAR-NK cell, is one of the most promising 'off-the-shelf' development without severe life-threatening toxicity. However, the bottleneck for developing a successful CAR-NK therapy is achieving sufficient numbers of non-exhaustive, long-lived, 'off-the-shelf' CAR-NK cells from a third party. Here, we developed a new CAR-NK expansion method using an Epstein-Barr virus- (EBV) transformed B cell line expressing a genetically modified membrane form of interleukin-21 (IL-21). In this protocol, step-by-step procedures are provided to expand NK and CAR-NK cells from cord blood and peripheral blood, as well as solid organ tissues. This work will significantly enhance the clinical development of CAR-NK immunotherapy.","Cell Line|Epstein-Barr Virus Infections|Herpesvirus 4, Human|Humans|Immunotherapy, Adoptive|Interleukin-21|Interleukins|Killer Cells, Natural","Ma, Minh|Badeti, Saiaditya|Kim, James K|Liu, Dongfang",Journal of visualized experiments : JoVE,"Journal Article|Research Support, N.I.H., Extramural|Research Support, Non-U.S. Gov't|Video-Audio Media",2022,HL150852,5U01HL150852-02,phs002583.v1.p1,RADx-rad,Novel Biosensing and VOC,1.0,"The publication abstract focuses on the expansion of CAR-NK cells for immunotherapy, which is unrelated to the funding opportunity and grant abstract that are centered on developing a breathalyzer diagnostic platform for COVID-19. The publication does not address any of the specific objectives related to biosensing technologies, VOC detection, or the development of rapid diagnostic tools for COVID-19.","The publication abstract is not related to the research objectives of the funding opportunity or the grant abstract. The funding opportunity and grant abstract focus on the development of novel biosensing and detection approaches for COVID-19, while the publication abstract discusses a method for expanding Natural Killer (NK) and CAR-NK cells using a membrane-bound IL-21-modified B cell line, which is not relevant to the topic of COVID-19 diagnostics."
35233546_phs002525.v1.p1,35233546,PMC8784611,doi:10.1016/j.xcrm.2022.100522,System-wide transcriptome damage and tissue identity loss in COVID-19 patients.,"The molecular mechanisms underlying the clinical manifestations of coronavirus disease 2019 (COVID-19), and what distinguishes them from common seasonal influenza virus and other lung injury states such as acute respiratory distress syndrome, remain poorly understood. To address these challenges, we combine transcriptional profiling of 646 clinical nasopharyngeal swabs and 39 patient autopsy tissues to define body-wide transcriptome changes in response to COVID-19. We then match these data with spatial protein and expression profiling across 357 tissue sections from 16 representative patient lung samples and identify tissue-compartment-specific damage wrought by severe acute respiratory syndrome coronavirus 2 (SARS-CoV-2) infection, evident as a function of varying viral loads during the clinical course of infection and tissue-type-specific expression states. Overall, our findings reveal a systemic disruption of canonical cellular and transcriptional pathways across all tissues, which can inform subsequent studies to combat the mortality of COVID-19 and to better understand the molecular dynamics of lethal SARS-CoV-2 and other respiratory infections.","Adult|Aged|Aged, 80 and over|COVID-19|Case-Control Studies|Cohort Studies|Female|Gene Expression Regulation|Humans|Influenza, Human|Lung|Male|Middle Aged|NGS|Orthomyxoviridae|RNA-Seq|RNA-seq|Respiratory Distress Syndrome|SARS-CoV-2|Transcriptome|Viral Load|coronavirus|coronavirus disease 2019|evere acute respiratory syndrome coronavirus 2|host response|next-generation sequencing|spatial transcriptomics","Park, Jiwoon|Foox, Jonathan|Hether, Tyler|Danko, David C|Warren, Sarah|Kim, Youngmi|Reeves, Jason|Butler, Daniel J|Mozsary, Christopher|Rosiene, Joel|Shaiber, Alon|Afshin, Evan E|MacKay, Matthew|Rendeiro, André F|Bram, Yaron|Chandar, Vasuretha|Geiger, Heather|Craney, Arryn|Velu, Priya|Melnick, Ari M|Hajirasouliha, Iman|Beheshti, Afshin|Taylor, Deanne|Saravia-Butler, Amanda|Singh, Urminder|Wurtele, Eve Syrkin|Schisler, Jonathan|Fennessey, Samantha|Corvelo, André|Zody, Michael C|Germer, Soren|Salvatore, Steven|Levy, Shawn|Wu, Shixiu|Tatonetti, Nicholas P|Shapira, Sagi|Salvatore, Mirella|Westblade, Lars F|Cushing, Melissa|Rennert, Hanna|Kriegel, Alison J|Elemento, Olivier|Imielinski, Marcin|Rice, Charles M|Borczuk, Alain C|Meydan, Cem|Schwartz, Robert E|Mason, Christopher E",Cell reports. Medicine,"Journal Article|Research Support, N.I.H., Extramural|Research Support, Non-U.S. Gov't|Research Support, U.S. Gov't, Non-P.H.S.",2022,DA053941,1U01DA053941-01,phs002525.v1.p1,RADx-rad,Wastewater,1.5,"The publication abstract focuses on the molecular mechanisms of COVID-19 and its effects on the transcriptome, which is unrelated to the funding opportunity and grant abstract that focus on wastewater-based surveillance for SARS-CoV-2 detection. The publication does not address any aspects of wastewater testing, sample collection, or data integration with the RADx-rad initiative.","The publication abstract does not directly address the research objectives of the funding opportunity or the grant abstract, which focus on wastewater-based testing for SARS-CoV-2 and the development of a surveillance infrastructure. The publication abstract discusses transcriptome changes in COVID-19 patients and tissue damage, which is a different area of research. While both the funding opportunity and the publication abstract relate to COVID-19, they do not share a common research objective or methodology."
35303007_phs002583.v1.p1,35303007,PMC8955962,doi:10.1371/journal.pcbi.1009883,In vitro machine learning-based CAR T immunological synapse quality measurements correlate with patient clinical outcomes.,"The human immune system consists of a highly intelligent network of billions of independent, self-organized cells that interact with each other. Machine learning (ML) is an artificial intelligence (AI) tool that automatically processes huge amounts of image data. Immunotherapies have revolutionized the treatment of blood cancer. Specifically, one such therapy involves engineering immune cells to express chimeric antigen receptors (CAR), which combine tumor antigen specificity with immune cell activation in a single receptor. To improve their efficacy and expand their applicability to solid tumors, scientists optimize different CARs with different modifications. However, predicting and ranking the efficacy of different ""off-the-shelf"" immune products (e.g., CAR or Bispecific T-cell Engager [BiTE]) and selection of clinical responders are challenging in clinical practice. Meanwhile, identifying the optimal CAR construct for a researcher to further develop a potential clinical application is limited by the current, time-consuming, costly, and labor-intensive conventional tools used to evaluate efficacy. Particularly, more than 30 years of immunological synapse (IS) research data demonstrate that T cell efficacy is not only controlled by the specificity and avidity of the tumor antigen and T cell interaction, but also it depends on a collective process, involving multiple adhesion and regulatory molecules, as well as tumor microenvironment, spatially and temporally organized at the IS formed by cytotoxic T lymphocytes (CTL) and natural killer (NK) cells. The optimal function of cytotoxic lymphocytes (including CTL and NK) depends on IS quality. Recognizing the inadequacy of conventional tools and the importance of IS in immune cell functions, we investigate a new strategy for assessing CAR-T efficacy by quantifying CAR IS quality using the glass-support planar lipid bilayer system combined with ML-based data analysis. Previous studies in our group show that CAR-T IS quality correlates with antitumor activities in vitro and in vivo. However, current manually quantified IS quality data analysis is time-consuming and labor-intensive with low accuracy, reproducibility, and repeatability. In this study, we develop a novel ML-based method to quantify thousands of CAR cell IS images with enhanced accuracy and speed. Specifically, we used artificial neural networks (ANN) to incorporate object detection into segmentation. The proposed ANN model extracts the most useful information to differentiate different IS datasets. The network output is flexible and produces bounding boxes, instance segmentation, contour outlines (borders), intensities of the borders, and segmentations without borders. Based on requirements, one or a combination of this information is used in statistical analysis. The ML-based automated algorithm quantified CAR-T IS data correlates with the clinical responder and non-responder treated with Kappa-CAR-T cells directly from patients. The results suggest that CAR cell IS quality can be used as a potential composite biomarker and correlates with antitumor activities in patients, which is sufficiently discriminative to further test the CAR IS quality as a clinical biomarker to predict response to CAR immunotherapy in cancer. For translational research, the method developed here can also provide guidelines for designing and optimizing numerous CAR constructs for potential clinical development. Trial Registration: ClinicalTrials.gov NCT00881920.","Antigens, Neoplasm|Artificial Intelligence|Biomarkers|Humans|Immunological Synapses|Machine Learning|Neoplasms|Receptors, Chimeric Antigen|Reproducibility of Results|Tumor Microenvironment","Naghizadeh, Alireza|Tsao, Wei-Chung|Hyun Cho, Jong|Xu, Hongye|Mohamed, Mohab|Li, Dali|Xiong, Wei|Metaxas, Dimitri|Ramos, Carlos A|Liu, Dongfang",PLoS computational biology,"Clinical Study|Journal Article|Research Support, N.I.H., Extramural|Research Support, Non-U.S. Gov't",2022,HL150852,5U01HL150852-02,phs002583.v1.p1,RADx-rad,Novel Biosensing and VOC,1.5,"The publication abstract focuses on machine learning-based analysis of CAR T cell immunological synapses and their correlation with clinical outcomes in cancer treatment. This is unrelated to the funding opportunity and grant abstract, which are centered on developing non-invasive biosensing technologies for COVID-19 detection using breath analysis. The publication does not address COVID-19, biosensing, or the specific objectives outlined in the funding opportunity.","The publication abstract is not directly related to the research objectives of the funding opportunity or the grant abstract. The funding opportunity and grant abstract focus on the development of novel biosensing and detection approaches for COVID-19, specifically using volatile organic compounds (VOCs) from skin and the oral cavity. In contrast, the publication abstract discusses the use of machine learning to measure the quality of immunological synapses in CAR T cells, which is a different area of research. While both topics involve biomedical research, they are not closely related, and the publication abstract does not address the specific goals and objectives outlined in the funding opportunity and grant abstract."
35332292_phs002544.v1.p1,35332292,PMC9200603,doi:10.1038/s41563-022-01210-8,Harmonic acoustics for dynamic and selective particle manipulation.,"Precise and selective manipulation of colloids and biological cells has long been motivated by applications in materials science, physics and the life sciences. Here we introduce our harmonic acoustics for a non-contact, dynamic, selective (HANDS) particle manipulation platform, which enables the reversible assembly of colloidal crystals or cells via the modulation of acoustic trapping positions with subwavelength resolution. We compose Fourier-synthesized harmonic waves to create soft acoustic lattices and colloidal crystals without using surface treatment or modifying their material properties. We have achieved active control of the lattice constant to dynamically modulate the interparticle distance in a high-throughput (>100 pairs), precise, selective and reversible manner. Furthermore, we apply this HANDS platform to quantify the intercellular adhesion forces among various cancer cell lines. Our biocompatible HANDS platform provides a highly versatile particle manipulation method that can handle soft matter and measure the interaction forces between living cells with high sensitivity.",Acoustics|Colloids|Materials Science,"Yang, Shujie|Tian, Zhenhua|Wang, Zeyu|Rufo, Joseph|Li, Peng|Mai, John|Xia, Jianping|Bachman, Hunter|Huang, Po-Hsun|Wu, Mengxi|Chen, Chuyi|Lee, Luke P|Huang, Tony Jun",Nature materials,"Journal Article|Research Support, N.I.H., Extramural|Research Support, U.S. Gov't, Non-P.H.S.",2022,TR003778,1U18TR003778-01,phs002544.v1.p1,RADx-rad,Exosome,2.5,"The publication abstract describes a platform for particle manipulation using harmonic acoustics, which is related to the technology mentioned in the grant abstract (Acoustofluidic Separation). However, the publication does not specifically address the detection of SARS-CoV-2 or COVID-19, which is the primary focus of the funding opportunity. While the technology is relevant, the publication's focus is more on the manipulation of particles and cells rather than diagnostic applications for COVID-19.","The publication abstract does not directly address the research objectives of the funding opportunity or the grant abstract. The funding opportunity and grant abstract focus on the development of technologies for the detection of SARS-CoV-2 using single extracellular vesicle, exosome, and extracellular RNA (exRNA) isolation and analysis. The publication abstract, on the other hand, discusses a platform for non-contact, dynamic, and selective particle manipulation using harmonic acoustics, which does not appear to be directly related to SARS-CoV-2 detection or exosome-based technologies. While the publication abstract mentions the manipulation of colloids and biological cells, it does not specifically mention exosomes, SARS-CoV-2, or COVID-19, and its focus is more on materials science and cell manipulation rather than diagnostics or detection."
35337047_phs002573.v1.p1,35337047,PMC8949778,doi:10.3390/v14030640,Mutations and Evolution of the SARS-CoV-2 Spike Protein.,"The SARS-CoV-2 spike protein mediates target recognition, cellular entry, and ultimately the viral infection that leads to various levels of COVID-19 severities. Positive evolutionary selection of mutations within the spike protein has led to the genesis of new SARS-CoV-2 variants with greatly enhanced overall fitness. Given the trend of variants with increased fitness arising from spike protein alterations, it is critical that the scientific community understand the mechanisms by which these mutations alter viral functions. As of March 2022, five SARS-CoV-2 strains were labeled ""variants of concern"" by the World Health Organization: the Alpha, Beta, Gamma, Delta, and Omicron variants. This review summarizes the potential mechanisms by which the common mutations on the spike protein that occur within these strains enhance the overall fitness of their respective variants. In addressing these mutations within the context of the SARS-CoV-2 spike protein structure, spike/receptor binding interface, spike/antibody binding, and virus neutralization, we summarize the general paradigms that can be used to estimate the effects of future mutations along SARS-CoV-2 evolution.","COVID-19|Humans|Membrane Glycoproteins|Mutation|SARS-CoV-2|Spike Glycoprotein, Coronavirus|Viral Envelope Proteins|evolution|immune escape|infectivity|mutation|spike","Magazine, Nicholas|Zhang, Tianyi|Wu, Yingying|McGee, Michael C|Veggiani, Gianluca|Huang, Weishan",Viruses,"Journal Article|Research Support, N.I.H., Extramural|Research Support, Non-U.S. Gov't|Review",2022,AA029348,1U01AA029348-01,phs002573.v1.p1,RADx-rad,Automatic Detection & Tracing,2.5,"The publication abstract focuses on the mutations and evolution of the SARS-CoV-2 spike protein, discussing how these changes affect viral fitness and the emergence of new variants. This is unrelated to the funding opportunity and grant abstract, which are centered on developing a biosensing platform integrated with digital devices for real-time detection and tracing of SARS-CoV-2. The publication does not address any of the objectives related to biosensing technology, signal transduction, or data coordination mentioned in the funding opportunity.","The publication abstract is related to the research objectives of the funding opportunity and the grant abstract. The funding opportunity focuses on the development of innovative platforms for detecting and tracing SARS-CoV-2, while the grant abstract describes a specific project aimed at developing a pipeline for automatic detection and tracing of active SARS-CoV-2 infection. The publication abstract discusses the mutations and evolution of the SARS-CoV-2 spike protein, which is a critical component in understanding the virus's behavior and developing effective detection and tracing methods. Although the publication abstract does not directly address the development of detection and tracing systems, it provides valuable insights into the viral mechanisms that such systems aim to target. Therefore, the publication abstract is relevant to the research objectives of the funding opportunity and the grant abstract, but its connection is more indirect and focused on the underlying biology of the virus rather than the development of specific detection and tracing technologies."
35379001_phs002924.v1.p1,35379001,PMC9076410,doi:10.1152/ajprenal.00400.2021,Physiology assays in human kidney organoids.,"Kidney organoids derived from human pluripotent stem cells constitute a novel model of disease, development, and regenerative therapy. Organoids are human, experimentally accessible, high throughput, and enable reconstitution of tissue-scale biology in a petri dish. Although gene expression patterns in organoid cells have been analyzed extensively, less is known about the functionality of these structures. Here, we review assays of physiological function in human kidney organoids, including best practices for quality control, and future applications. Tubular structures in organoids accumulate specific molecules through active transport, including dextran and organic anions, and swell with fluid in response to cAMP stimulation. When engrafted into animal models in vivo, organoids form vascularized glomerulus-like structures capable of size-selective filtration. Organoids exhibit metabolic, endocrine, injury, and infection phenotypes, although their specificity is not yet fully clear. To properly interpret organoid physiology assays, it is important to incorporate appropriate negative and positive controls, statistical methods, data presentation, molecular mechanisms, and clinical data sets. Improvements in organoid perfusion, patterning, and maturation are needed to enable branching morphogenesis, urine production, and renal replacement. Reconstituting renal physiology with kidney organoids is a new field with potential to provide fresh insights into classical phenomena.",Animals|Cell Differentiation|Humans|Kidney|Kidney Glomerulus|Morphogenesis|Organoids|Pluripotent Stem Cells|absorption|filtration|hormone|kidney-on-chip|nephrotoxicity,"Freedman, Benjamin S",American journal of physiology. Renal physiology,"Journal Article|Research Support, N.I.H., Extramural|Research Support, Non-U.S. Gov't|Research Support, U.S. Gov't, Non-P.H.S.|Review",2022,HL152401,3U01HL152401-02S1,phs002924.v1.p1,RADx-rad,Novel Biosensing and VOC,1.0,"The publication abstract focuses on the development and analysis of human kidney organoids, specifically their physiological functions and assays. This is unrelated to the funding opportunity and grant abstract, which are centered on the development of biosensing technologies for detecting COVID-19 biomarkers using eNose biosensors. The publication does not address any aspects of VOC detection, biosensors, or COVID-19 diagnostics, making it irrelevant to the research objectives outlined in the funding opportunity.","The publication abstract is not related to the research objectives of the funding opportunity or the grant abstract. The funding opportunity and grant abstract focus on the development of novel biosensing and detection approaches for COVID-19 diagnosis, specifically using volatile organic compound (VOC) biomarkers and biomimetic olfaction-based sensors. In contrast, the publication abstract discusses physiology assays in human kidney organoids, which is a completely different topic and does not address the specific research aims and objectives outlined in the funding opportunity and grant abstract."
