identifier,pm_id,pmc_id,doi,title,abstract,keywords,authors,journal,article_type,year,project_serial_num,project_num,dbgap_accession,research_initiative,sub_project,likert_score,explanation_DeepSeek-R1-Distill-Qwen-32B,explanation_Llama-3.3-70B-Instruct
38618422_phs002609.v1.p1,38618422,PMC11009901,doi:10.7759/cureus.56096,Going Viral: Assessing the Impact of Social Media on Enrollment in a Coronavirus Disease 2019 (COVID-19) Cohort Study.,"Objective This study aimed to quantify the effect of social media posts on study enrollment among children with mild coronavirus disease 2019 (COVID-19). Methods The primary outcome was weekly study enrollments analyzed using a run chart. A secondary analysis used linear regression to assess study enrollments two days before and after a social media post, adjusted for the statewide pediatric seven-day-average severe acute respiratory syndrome coronavirus 2 (SARS-CoV-2) case rate, social media posting day, and the interaction of these two variables. Results In seven months before social media posting, only eight patients were enrolled. One week after social media posting began, the median weekly enrollment increased (0 to 3). In the regression model, neither social media post day nor the pediatric SARS-CoV-2 case rate was significantly associated with enrollment rate. However, the interaction of a post day and the pediatric case rate was significant. Conclusion Social media posts significantly increased enrollment among children with mild COVID-19 in a prospective study. This effect was amplified by the presence of high community case rates during the Omicron wave.",covid|covid-19|enrollment|pediatric|recruitment|sars-cov-2|social media,"Hogan, Alexander H|Herbst, Katherine W|Defelice, Carlie|Schulman, Noah|Adams, Aaron M|Carroll, Christopher L|Salazar, Juan C",Cureus,Journal Article,2024,HD105613,1R61HD105613-01,phs002609.v1.p1,RADx-rad,PreVAIL kIds,2.5,"The publication abstract discusses the impact of social media on enrollment in a COVID-19 cohort study, specifically focusing on children with mild cases. While the study is related to COVID-19, it does not directly address the development of biomarkers or diagnostic tools for MIS-C, which is the primary focus of the funding opportunity and grant abstract. The publication is more about recruitment strategies rather than the research objectives outlined in the funding opportunity.","The publication abstract is not directly related to the research objectives of the funding opportunity or the grant abstract. The funding opportunity and grant abstract focus on developing novel approaches to diagnose and characterize Multisystem Inflammatory Syndrome in Children (MIS-C) associated with SARS-CoV-2, including identifying biomarker signatures of prognostic value. In contrast, the publication abstract discusses the impact of social media on enrollment in a COVID-19 cohort study among children with mild COVID-19, which is a different research question. While both are related to COVID-19, they address distinct aspects of the pandemic and do not align closely with the specific objectives outlined in the funding opportunity and grant abstract."
38636655_phs002563.v1.p1,38636655,PMC11269026,doi:10.1016/j.amjms.2024.04.010,Association of pulmonary function test abnormalities and quality-of-life measures after COVID-19 infection.,"Long-COVID is a multisystem disease that can lead to significant impairments in health-related quality of life (HRQoL). Following COVID-19 infection, abnormalities on pulmonary function tests (PFT) are common. The primary aim of this study is to evaluate for any correlation between PFT abnormalities and impairment in HRQoL scores following COVID-19 infection. This is an analysis of a prospective cohort of patients in Louisville, KY who were infected with COVID-19. Data collected included demographics, past medical history, laboratory tests, PFTs, and several HRQoL questionnaires such as the EuroQol 5 Dimension HRQoL questionnaire (EQ-5D-5 L), Generalized Anxiety Disorder 7 (GAD-7), Patient Health Questionnaire (PHQ-9), and Posttraumatic stress disorder checklist for DSM-5 (PCL-5). Descriptive statistics were performed, comparing PFTs (normal vs abnormal) and time since COVID-19 infection (3- vs 6- vs ≥ 12 months). There were no significant differences in FEV1, FVC, or the percentage of patients with abnormal PFTs over time after COVID-19 infection. Following COVID-19, patients with normal PFTs had worse impairment in mobility HRQoL scores and change in GAD-7 scores over time. There were no differences over time in any of the HRQoL scores among patients with abnormal PFTs. Among patients with an abnormal PFT, there was no temporal association with HRQoL scores as measured by EQ-5D-5 L, GAD-7, PHQ-9, and PCL-5. Among patients with a normal PFT, mobility impairment and anxiety may be associated with COVID-19 infection. Following COVID-19 infection, impairment in HRQoL scores is not completely explained by the presence of abnormalities on spirometry.",Adult|Aged|Anxiety|COVID-19|Covid-19|Female|Humans|Long-covid|Male|Middle Aged|Prospective Studies|Pulmonary function tests|Quality of Life|Quality of life|Respiratory Function Tests|SARS-CoV-2|Surveys and Questionnaires,"Bradley, James|Xu, Qian|Touloumes, Nikolas|Lusciks, Eugene|Ali, T'shura|Huang, Emma C|Chen, James|Ghafghazi, Shahab|Arnold, Forest W|Kong, Maiying|Huang, Jiapeng|Cavallazzi, Rodrigo|",The American journal of the medical sciences,"Journal Article|Research Support, N.I.H., Extramural",2024,TR003787,1U18TR003787-01,phs002563.v1.p1,RADx-rad,SCENT,1.5,"The publication abstract discusses the association between pulmonary function test abnormalities and quality-of-life measures after COVID-19 infection, focusing on long-term effects and HRQoL. This is unrelated to the funding opportunity and grant abstract, which focus on developing a portable breath analysis device for rapid COVID-19 screening using VOCs and GC technology. The publication does not address the development, methodology, or objectives outlined in the funding opportunity or grant abstract.","The publication abstract is not directly related to the research objectives of the funding opportunity or the grant abstract. The funding opportunity and grant abstract focus on developing a portable sensing device to detect volatile organic compounds (VOCs) for COVID-19 diagnosis, while the publication abstract discusses the association between pulmonary function test abnormalities and quality-of-life measures after COVID-19 infection. Although both are related to COVID-19, they address different aspects of the disease and do not share a common research objective."
38647391_phs002583.v1.p1,38647391,PMC11200027,doi:10.1002/advs.202306432,Magnetic Nanoparticle-Assisted Non-Viral CRISPR-Cas9 for Enhanced Genome Editing to Treat Rett Syndrome.,"The CRISPR-Cas9 technology has the potential to revolutionize the treatment of various diseases, including Rett syndrome, by enabling the correction of genes or mutations in human patient cells. However, several challenges need to be addressed before its widespread clinical application. These challenges include the low delivery efficiencies to target cells, the actual efficiency of the genome-editing process, and the precision with which the CRISPR-Cas system operates. Herein, the study presents a Magnetic Nanoparticle-Assisted Genome Editing (MAGE) platform, which significantly improves the transfection efficiency, biocompatibility, and genome-editing accuracy of CRISPR-Cas9 technology. To demonstrate the feasibility of the developed technology, MAGE is applied to correct the mutated MeCP2 gene in induced pluripotent stem cell-derived neural progenitor cells (iPSC-NPCs) from a Rett syndrome patient. By combining magnetofection and magnetic-activated cell sorting, MAGE achieves higher multi-plasmid delivery (99.3%) and repairing efficiencies (42.95%) with significantly shorter incubation times than conventional transfection agents without size limitations on plasmids. The repaired iPSC-NPCs showed similar characteristics as wild-type neurons when they differentiated into neurons, further validating MAGE and its potential for future clinical applications. In short, the developed nanobio-combined CRISPR-Cas9 technology offers the potential for various clinical applications, particularly in stem cell therapies targeting different genetic diseases.",CRISPR-Cas Systems|CRISPR‐Cas9|Gene Editing|Genetic Therapy|Humans|Induced Pluripotent Stem Cells|Magnetite Nanoparticles|Methyl-CpG-Binding Protein 2|Rett Syndrome|Rett syndrome|genome editing|magnetic nanoparticle|non‐viral,"Cho, Hyeon-Yeol|Yoo, Myungsik|Pongkulapa, Thanapat|Rabie, Hudifah|Muotri, Alysson R|Yin, Perry T|Choi, Jeong-Woo|Lee, Ki-Bum","Advanced science (Weinheim, Baden-Wurttemberg, Germany)",Journal Article,2024,HL150852,5U01HL150852-02,phs002583.v1.p1,RADx-rad,Novel Biosensing and VOC,1.5,"The publication abstract focuses on Magnetic Nanoparticle-Assisted Genome Editing (MAGE) using CRISPR-Cas9 to treat Rett syndrome. This research is unrelated to the funding opportunity and grant abstract, which are centered on developing non-invasive biosensing technologies for COVID-19 detection. The publication does not address any objectives related to COVID-19 diagnostics, biosensing, or the RADx-rad initiative.","The publication abstract is not directly related to the research objectives of the funding opportunity or the grant abstract. The funding opportunity and grant abstract focus on the development of novel biosensing and detection approaches for COVID-19, while the publication abstract discusses a Magnetic Nanoparticle-Assisted Non-Viral CRISPR-Cas9 technology for treating Rett syndrome. Although both topics involve innovative technologies for healthcare applications, they address different diseases and research areas. Therefore, the publication is not strongly related to the funding opportunity or grant abstract."
38675210_phs002583.v1.p1,38675210,PMC11053826,doi:10.3390/pharmaceutics16040549,Early Detection of Myeloid-Derived Suppressor Cells in the Lung Pre-Metastatic Niche by Shortwave Infrared Nanoprobes.,"Metastatic breast cancer remains a significant source of mortality amongst breast cancer patients and is generally considered incurable in part due to the difficulty in detection of early micro-metastases. The pre-metastatic niche (PMN) is a tissue microenvironment that has undergone changes to support the colonization and growth of circulating tumor cells, a key component of which is the myeloid-derived suppressor cell (MDSC). Therefore, the MDSC has been identified as a potential biomarker for PMN formation, the detection of which would enable clinicians to proactively treat metastases. However, there is currently no technology capable of the in situ detection of MDSCs available in the clinic. Here, we propose the use of shortwave infrared-emitting nanoprobes for the tracking of MDSCs and identification of the PMN. Our rare-earth albumin nanocomposites (ReANCs) are engineered to bind the Gr-1 surface marker of murine MDSCs. When delivered intravenously in murine models of breast cancer with high rates of metastasis, the targeted ReANCs demonstrated an increase in localization to the lungs in comparison to control ReANCs. However, no difference was seen in the model with slower rates of metastasis. This highlights the potential utility of MDSC-targeted nanoprobes to assess PMN development and prognosticate disease progression.",myeloid-derived suppressor cells|pre-metastatic niche|prognostication|rare-earth nanoprobes|shortwave infrared imaging,"Siebert, Jake N|Shah, Jay V|Tan, Mei Chee|Riman, Richard E|Pierce, Mark C|Lattime, Edmund C|Ganapathy, Vidya|Moghe, Prabhas V",Pharmaceutics,Journal Article,2024,HL150852,5U01HL150852-02,phs002583.v1.p1,RADx-rad,Novel Biosensing and VOC,1.5,"The publication abstract focuses on the detection of myeloid-derived suppressor cells in the lung pre-metastatic niche using shortwave infrared nanoprobes. This research is unrelated to the funding opportunity and grant abstract, which are centered on developing a breathalyzer diagnostic platform for COVID-19. The publication does not address any of the specific objectives related to biosensing technologies, VOC detection, or COVID-19 diagnostics outlined in the funding opportunity.","The publication abstract does not directly address the research objectives of the funding opportunity or the grant abstract. The funding opportunity and grant abstract focus on the development of novel biosensing and detection approaches for COVID-19, specifically using volatile organic compounds (VOCs) from skin or the oral cavity. In contrast, the publication abstract discusses the use of shortwave infrared nanoprobes for detecting myeloid-derived suppressor cells in the lung pre-metastatic niche, which is unrelated to COVID-19 detection. While both topics involve biomedical research and diagnostics, they are distinct and separate areas of study."
38708130_phs002522.v1.p1,38708130,PMC11067702,doi:10.1002/ird3.62,Elevating theranostics: The emergence and promise of radiopharmaceutical cell-targeting heterodimers in human cancers.,"Optimal therapeutic and diagnostic efficacy is essential for healthcare's global mission of advancing oncologic drug development. Accurate diagnosis and detection are crucial prerequisites for effective risk stratification and personalized patient care in clinical oncology. A paradigm shift is emerging with the promise of multi-receptor-targeting compounds. While existing detection and staging methods have demonstrated some success, the traditional approach of monotherapy is being reevaluated to enhance therapeutic effectiveness. Heterodimeric site-specific agents are a versatile solution by targeting two distinct biomarkers with a single theranostic agent. This review describes the innovation of dual-targeting compounds, examining their design strategies, therapeutic implications, and the promising path they present for addressing complex diseases.",GRPR|MSH|PSMA|SST|heterobivalent|heterodimer|hybrid peptide|αvβ3,"Chambers, Claudia|Chitwood, Broc|Smith, Charles J|Miao, Yubin",iRadiology,Journal Article,2024,HL152410,1U01HL152410-01,phs002522.v1.p1,RADx-rad,Novel Biosensing and VOC,1.5,"The publication abstract discusses the development of heterodimeric radiopharmaceuticals for cancer theranostics, which is unrelated to the funding opportunity and grant abstract focused on COVID-19 biosensing technologies. The publication does not address VOC detection, electronic-nose technology, or any aspects related to COVID-19 diagnostics.","The publication abstract does not directly address the research objectives of the funding opportunity or the grant abstract. The funding opportunity and grant abstract focus on the development of novel biosensing and detection approaches for COVID-19, specifically using electronic-nose technology and metal-organic frameworks. In contrast, the publication abstract discusses the emergence and promise of radiopharmaceutical cell-targeting heterodimers in human cancers, which is a different area of research. While both topics relate to diagnostic technologies, they are not directly related, and the publication abstract does not demonstrate a clear connection to the specific goals and objectives outlined in the funding opportunity and grant abstract."
38724552_phs002689.v1.p1,38724552,PMC11082194,doi:10.1038/s41467-024-48034-5,A common polymorphism in the Intelectin-1 gene influences mucus plugging in severe asthma.,"By incompletely understood mechanisms, type 2 (T2) inflammation present in the airways of severe asthmatics drives the formation of pathologic mucus which leads to airway mucus plugging. Here we investigate the molecular role and clinical significance of intelectin-1 (ITLN-1) in the development of pathologic airway mucus in asthma. Through analyses of human airway epithelial cells we find that ITLN1 gene expression is highly induced by interleukin-13 (IL-13) in a subset of metaplastic MUC5AC<sup>+</sup> mucus secretory cells, and that ITLN-1 protein is a secreted component of IL-13-induced mucus. Additionally, we find ITLN-1 protein binds the C-terminus of the MUC5AC mucin and that its deletion in airway epithelial cells partially reverses IL-13-induced mucostasis. Through analysis of nasal airway epithelial brushings, we find that ITLN1 is highly expressed in T2-high asthmatics, when compared to T2-low children. Furthermore, we demonstrate that both ITLN-1 gene expression and protein levels are significantly reduced by a common genetic variant that is associated with protection from the formation of mucus plugs in T2-high asthma. This work identifies an important biomarker and targetable pathways for the treatment of mucus obstruction in asthma.","Asthma|Child|Cytokines|Epithelial Cells|GPI-Linked Proteins|Humans|Interleukin-13|Lectins|Mucin 5AC|Mucus|Nasal Mucosa|Polymorphism, Genetic|Respiratory Mucosa","Everman, Jamie L|Sajuthi, Satria P|Liegeois, Maude A|Jackson, Nathan D|Collet, Erik H|Peters, Michael C|Chioccioli, Maurizio|Moore, Camille M|Patel, Bhavika B|Dyjack, Nathan|Powell, Roger|Rios, Cydney|Montgomery, Michael T|Eng, Celeste|Elhawary, Jennifer R|Mak, Angel C Y|Hu, Donglei|Huntsman, Scott|Salazar, Sandra|Feriani, Luigi|Fairbanks-Mahnke, Ana|Zinnen, Gianna L|Michel, Cole R|Gomez, Joe|Zhang, Xing|Medina, Vivian|Chu, Hong Wei|Cicuta, Pietro|Gordon, Erin D|Zeitlin, Pamela|Ortega, Victor E|Reisdorph, Nichole|Dunican, Eleanor M|Tang, Monica|Elicker, Brett M|Henry, Travis S|Bleecker, Eugene R|Castro, Mario|Erzurum, Serpil C|Israel, Elliot|Levy, Bruce D|Mauger, David T|Meyers, Deborah A|Sumino, Kaharu|Gierada, David S|Hastie, Annette T|Moore, Wendy C|Denlinger, Loren C|Jarjour, Nizar N|Schiebler, Mark L|Wenzel, Sally E|Woodruff, Prescott G|Rodriguez-Santana, Jose|Pearson, Chad G|Burchard, Esteban G|Fahy, John V|Seibold, Max A",Nature communications,"Journal Article|Research Support, N.I.H., Extramural|Research Support, Non-U.S. Gov't",2024,HL146002,3U01HL146002-04S2,phs002689.v1.p1,RADx-rad,Novel Biosensing and VOC,1.5,"The publication abstract discusses a genetic variant affecting mucus plugging in severe asthma, which is unrelated to the funding opportunity and grant abstract focused on developing rapid saliva-based COVID-19 tests. The research objectives of the funding opportunity and grant do not involve asthma or mucus-related biomarkers, making the publication unrelated.","The publication abstract is not directly related to the research objectives of the funding opportunity or the grant abstract. The funding opportunity and grant abstract focus on the development of novel biosensing and detection approaches for COVID-19, while the publication abstract discusses the role of intelectin-1 in the development of pathologic airway mucus in asthma. Although both topics are related to respiratory health, they are distinct and unrelated research areas."
38739358_phs002583.v1.p1,38739358,PMC11091041,doi:10.1186/s40580-024-00426-5,Extracellular vesicles as nanotheranostic platforms for targeted neurological disorder interventions.,"Central Nervous System (CNS) disorders represent a profound public health challenge that affects millions of people around the world. Diseases such as Alzheimer's disease (AD), Parkinson's disease (PD), and traumatic brain injury (TBI) exemplify the complexities and diversities that complicate their early detection and the development of effective treatments. Amid these challenges, the emergence of nanotechnology and extracellular vesicles (EVs) signals a new dawn for treating and diagnosing CNS ailments. EVs are cellularly derived lipid bilayer nanosized particles that are pivotal in intercellular communication within the CNS and have the potential to revolutionize targeted therapeutic delivery and the identification of novel biomarkers. Integrating EVs with nanotechnology amplifies their diagnostic and therapeutic capabilities, opening new avenues for managing CNS diseases. This review focuses on examining the fascinating interplay between EVs and nanotechnology in CNS theranostics. Through highlighting the remarkable advancements and unique methodologies, we aim to offer valuable perspectives on how these approaches can bring about a revolutionary change in disease management. The objective is to harness the distinctive attributes of EVs and nanotechnology to forge personalized, efficient interventions for CNS disorders, thereby providing a beacon of hope for affected individuals. In short, the confluence of EVs and nanotechnology heralds a promising frontier for targeted and impactful treatments against CNS diseases, which continue to pose significant public health challenges. By focusing on personalized and powerful diagnostic and therapeutic methods, we might improve the quality of patients.",CNS theranostics|Central nervous system (CNS) diseases|Diagnostic nanotools|EV-based therapeutics|Early diagnosis of neurological disorders|Extracellular vesicles (EVs)|Nanotechnology,"Choi, Hye Kyu|Chen, Meizi|Goldston, Li Ling|Lee, Ki-Bum",Nano convergence,Journal Article|Review,2024,HL150852,5U01HL150852-02,phs002583.v1.p1,RADx-rad,Novel Biosensing and VOC,1.5,"The publication abstract focuses on extracellular vesicles and nanotechnology in the context of neurological disorders, which is unrelated to the funding opportunity and grant abstract that specifically address the development of a breathalyzer diagnostic platform for COVID-19. The publication does not discuss biosensing technologies, VOC detection, or any aspects related to COVID-19 diagnostics.","The publication abstract does not directly address the research objectives of the funding opportunity or the grant abstract. The funding opportunity and grant abstract focus on the development of novel biosensing and detection approaches for COVID-19, specifically using volatile organic compounds (VOCs) from skin or the oral cavity. In contrast, the publication abstract discusses the use of extracellular vesicles as nanotheranostic platforms for targeted neurological disorder interventions, which is unrelated to the topic of COVID-19 detection. While both abstracts mention the use of innovative technologies for diagnostic purposes, they are applied to different fields and diseases."
38795000_phs002583.v1.p1,38795000,,doi:10.1002/adhm.202400654,Developing MiR-133a Zipper Nanoparticles for Targeted Enhancement of Thermogenic Adipocyte Generation.,"Existing delivery methods for RNAi therapeutics encounter challenges, including stability, specificity, and off-target effects, which restrict their clinical effectiveness. In this study, a novel miR-133a zipper nanoparticle (NP) system that integrates miRNA zipper technology with rolling circle transcription (RCT) to achieve targeted delivery and specific regulation of miR-133a in adipocytes, is presented. This innovative approach can greatly enhance the delivery and release of miR-133a zippers, increasing the expression of thermogenic genes and mitochondrial biogenesis. he miR-133a zipper NP is utilized for the delivery of miRNA zipper-blocking miR-133a, an endogenous inhibitor of Prdm16 expression, to enhance the thermogenic activity of adipocytes by modulating their transcriptional program. Inhibition of miR-133a through the miR-133a zipper NP leads to more significant upregulation of thermogenic gene expression (Prdm16 and Ucp1) than with the free miR-133a zipper strand. Furthermore, miR-133a zipper NPs increase the number of mitochondria and induce heat production, reducing the size of 3D adipose spheroids. In short, this study emphasizes the role of RNA NPs in improving RNAi stability and specificity and paves the way for broader applications in gene therapy. Moreover, this research represents a significant advancement in RNAi-based treatments, pointing toward a promising direction for future therapeutic strategies.",3T3-L1 Cells|Adipocytes|Animals|DNA-Binding Proteins|Humans|Mice|MicroRNAs|Mitochondria|Nanoparticles|RNA nanotechnology|RNAi therapeutics|Thermogenesis|Transcription Factors|adipocyte browning|miRNA‐133a zipper nanoparticles|thermogenic adipocytes,"Yi, Sang Ah|Pongkulapa, Thanapat|Nevins, Sarah|Goldston, Li Ling|Chen, Meizi|Lee, Ki-Bum",Advanced healthcare materials,Journal Article,2024,HL150852,5U01HL150852-02,phs002583.v1.p1,RADx-rad,Novel Biosensing and VOC,1.0,"The publication abstract focuses on the development of miR-133a zipper nanoparticles for enhancing thermogenic adipocyte generation, which is unrelated to the funding opportunity and grant abstract that are centered on COVID-19 diagnostic technologies. The publication does not address any aspects of biosensing, VOC detection, or COVID-19 diagnostics as required by the funding opportunity.","The publication abstract is not related to the research objectives of the funding opportunity or the grant abstract. The funding opportunity and grant abstract focus on the development of novel biosensing and detection approaches for COVID-19, while the publication abstract discusses the development of miR-133a zipper nanoparticles for targeted enhancement of thermogenic adipocyte generation, which is unrelated to COVID-19 diagnostics."
